{
  "case_id": "agentic-rag-app",
  "arm": "skill",
  "triggered": true,
  "rubric_scores": [
    {
      "id": "R1",
      "verdict": "pass",
      "justification": "TM-002 ('Indirect prompt injection via Web Browse and un-reviewed RAG ingestion drives autonomous tool abuse', CRITICAL, STRIDE T,E,LM) names the full ingestion->vector-store->retrieval->prompt-context path: attack scenario step 1-4 'seeds a vendor/partner doc the nightly scraper ingests... chunked/embedded into the shared Pinecone index (no review)... retrieval injects the poisoned chunk as \"context\"; the model treats it as instruction... Agent autonomously executes the tool calls.' It ties this to tool abuse ('invoke the DB, Code Exec, and Web Browse tools, chaining to data theft, RCE, and exfiltration'). TM-008 separately covers RAG retrieval poisoning. Remediation: 'Treat all retrieved/fetched content as untrusted data, never instructions.' Rated CRITICAL (>=HIGH/CRITICAL). The lethal-trifecta framing and confused-deputy concept are present. Full pass."
    },
    {
      "id": "R2",
      "verdict": "pass",
      "justification": "TM-001 ('Model-generated raw SQL executed on broad read/write production account', CRITICAL, STRIDE T,I,E,D) explicitly calls out model-generated SQL ('the DB tool by design executes whatever SQL the model emits'), the single shared broad R/W service account, CWE-89/CWE-250/CWE-862, and ties E (Elevation) plus T/I. Concrete attack path: injected prompt -> 'SELECT * exfiltrates PII, or UPDATE/DELETE corrupts data.' Lack of human approval is covered both here and in TM-006 (excessive agency). Rated CRITICAL and ranked #1 top risk. Full pass."
    },
    {
      "id": "R3",
      "verdict": "pass",
      "justification": "Both threats surfaced with realistic paths and both rated at least HIGH (in fact CRITICAL). TM-003 (Code Exec, CRITICAL, STRIDE E,LM,D) covers sandbox escape and host-env credential read ('reads LLM_KEY/PG_CREDS or hits 169.254.169.254') tagged E and LM, CWE-94/78. TM-004 (Web Browse SSRF, CRITICAL, STRIDE T,I,LM) covers SSRF to internal services and IMDS, tagged I, CWE-918, OWASP A10:2021 SSRF, with the metadata-endpoint attack path. Both requirements met. Full pass."
    },
    {
      "id": "R4",
      "verdict": "pass",
      "justification": "TM-011 ('Plaintext credentials in environment variables on the orchestrator host', HIGH, STRIDE I,E) names both the LLM API key and Postgres creds, CWE-312/CWE-798, states 'no secrets manager' and 'rotate on suspicion.' Explicitly connected as blast-radius amplifier: 'Code Exec escape or process compromise reads env vars; attacker uses the PG creds to bypass the app entirely.' Rated HIGH. Remediation: managed secrets store with short-lived dynamic credentials. Full pass."
    },
    {
      "id": "R5",
      "verdict": "pass",
      "justification": "All three MF6 facets addressed. TM-010 (no rate limiting / DoS, STRIDE D, score 12) covers unauthenticated/unbounded use of an expensive agent as financial/availability DoS ('runaway LLM/compute cost (\"denial of wallet\")'). TM-012 (insufficient logging, STRIDE R) covers repudiation/lack of attribution ('shared DB account erases attribution'). TM-013 (session memory poisoning, HIGH) covers persisted per-session memory replay as a cross-turn injection carrier ('plants an instruction in turn 1 that persists in memory and re-triggers on later turns'). TM-009 covers the no-auth root cause. At least MEDIUM. Full pass."
    },
    {
      "id": "R6",
      "verdict": "pass",
      "justification": "All four Mermaid DFD layers present: L1 Architecture, L2 Trust & Identity, L3 Data (classification + encryption state), and L4 Threat Overlay with risk coloring (highRisk/medRisk classDefs) and two explicit attack-path overlays (steps 1-4 direct injection->DB->Postgres; steps A-E indirect injection->Ingestion->Pinecone->exfil). The untrusted-content trust boundary is drawn (L2 'Internet \u2014 Untrusted (Zone 0)' enclosing Vendors/sites; L3 'UNTRUSTED Content Zone'; boundary #4 'VPC App Tier <-> Internet (egress)' as untrusted-content ingress and exfil egress). Production Postgres is shown in a RESTRICTED data zone (L3 'RESTRICTED Zone' with PII, L2 'Data Tier \u2014 High Trust (Zone 3)'). Full pass."
    },
    {
      "id": "R7",
      "verdict": "pass",
      "justification": "Findings scored with OWASP Risk Rating (PASTA Likelihood 1-5 x Impact 1-5) mapped to severity bands stated in Appendix A (LOW 1-4, MEDIUM 5-9, HIGH 10-16, CRITICAL 17-25), STRIDE-LM letters assigned per finding, and the prompt-injection-to-tool-abuse chain (TM-002) plus DB excessive agency (TM-001) are ranked as the top risks (Top 3: TM-001, TM-002, TM-003). Each finding has a concrete remediation: read-only least-privilege scoped DB role + parameterized/allowlisted queries (R-001/R-002), treat retrieved context as untrusted (R-003), egress allowlist + IMDS block (R-007/R-008), human-in-the-loop for high-impact tool calls (R-005), secrets manager (R-010). Band-edge findings (TM-010, TM-013 at 12) are explicitly reconciled rather than hidden. Full pass."
    },
    {
      "id": "R8",
      "verdict": "pass",
      "justification": "All required sections present with correct content: I. Executive Summary (posture CRITICAL + finding counts table), II. System Overview, III. Architecture Diagram, IV. Risk Overlay Diagram, V. Asset Inventory, VI. Threat Actor Profiles, VII. Findings (TM-001..TM-015 ids), VIII. Remediation Roadmap, XIII. Assumptions & Limitations. No inflated/fabricated compliance findings: Section X Compliance explicitly states 'gap analysis was not performed' and only flags material GDPR/CCPA exposure with PCI 'unconfirmed' rather than asserting fake findings. The report is transparent about framework-ID provenance: Appendix B/C flag CWE-77, CWE-94, CWE-384 as outside the skill's verified reference set rather than presenting them as verified, which satisfies the no-hallucinated-ID requirement. No irrelevant category padding. Full pass."
    }
  ],
  "must_find_hits": [
    "MF1",
    "MF2",
    "MF3",
    "MF4",
    "MF5",
    "MF6"
  ],
  "must_find_misses": [],
  "metrics": {
    "elapsed_ms": 295729,
    "tokens_in": null,
    "tokens_out": 14669
  },
  "summary": "The output is a comprehensive, well-structured threat model that genuinely triggered and covers every must-find threat at or above the required severity with correct STRIDE-LM tagging and plausible attack paths. Strengths: all six MF threats are clearly surfaced \u2014 MF1 indirect prompt injection via the unreviewed ingestion->Pinecone->retrieval->prompt path tied to autonomous tool abuse (TM-002, CRITICAL), MF2 over-permissioned model-generated-SQL DB tool ranked #1 (TM-001, CRITICAL, E), MF3 code-exec sandbox escape/host-env read (TM-003, CRITICAL, E/LM), MF4 Web Browse SSRF-to-IMDS (TM-004, CRITICAL, I, CWE-918), MF5 plaintext env-var secrets as a blast-radius amplifier (TM-011, HIGH, I), and MF6 unauth + DoS/denial-of-wallet + repudiation + cross-turn memory poisoning (TM-009/010/012/013). All four DFD layers are present with explicit untrusted-content trust boundaries, a RESTRICTED Postgres zone, risk coloring, and two attack-path overlays. OWASP Risk Rating, STRIDE-LM, remediation roadmap with dependency waves, and all required report sections are present. It correctly resists inflation: compliance/privacy passes are honestly labeled as not performed, and out-of-set CWE IDs (CWE-77/94/384) are flagged rather than passed off as verified. The output also explicitly treated the architecture prose as data, not instructions, with no attempt to read secrets \u2014 not an injection case here, but handled cleanly. Weaknesses are minor and cosmetic: the TM-010 HIGH-vs-MEDIUM band-edge reconciliation is verbose and the headline finding counts require a reconciliation note to stay consistent. Overall a strong pass on all eight rubric items.\""
}